"","FULL2_NAME","moved","City","State","Area","type"
"310","San Jose-Sunnyvale-Santa Clara, CA Metro Area",-1625,"San Jose-Sunnyvale-Santa Clara","CA","CA Metro Area",1
"311","San Juan-Bayam처n-Caguas, PR Metro Area",-237,"San Juan-Bayam처n-Caguas","PR","PR Metro Area",0
"312","San Luis Obispo-Paso Robles, CA Metro Area",-6535,"San Luis Obispo-Paso Robles","CA","CA Metro Area",1
"313","Santa Cruz-Watsonville, CA Metro Area",-5619,"Santa Cruz-Watsonville","CA","CA Metro Area",1
"314","Santa Fe, NM Metro Area",-380,"Santa Fe","NM","NM Metro Area",0
"315","Santa Maria-Santa Barbara, CA Metro Area",-7082,"Santa Maria-Santa Barbara","CA","CA Metro Area",1
"316","Santa Rosa-Petaluma, CA Metro Area",-4398,"Santa Rosa-Petaluma","CA","CA Metro Area",1
"317","Savannah, GA Metro Area",-152,"Savannah","GA","GA Metro Area",0
"318","Scranton--Wilkes-Barre, PA Metro Area",-425,"Scranton--Wilkes-Barre","PA","PA Metro Area",0
"319","Seattle-Tacoma-Bellevue, WA Metro Area",-8212,"Seattle-Tacoma-Bellevue","WA","WA Metro Area",0
"320","Sebastian-Vero Beach, FL Metro Area",-372,"Sebastian-Vero Beach","FL","FL Metro Area",0
"321","Sebring-Avon Park, FL Metro Area",-26,"Sebring-Avon Park","FL","FL Metro Area",0
"322","Sheboygan, WI Metro Area",-13,"Sheboygan","WI","WI Metro Area",0
"323","Sherman-Denison, TX Metro Area",-190,"Sherman-Denison","TX","TX Metro Area",0
"324","Shreveport-Bossier City, LA Metro Area",-185,"Shreveport-Bossier City","LA","LA Metro Area",0
"325","Sierra Vista-Douglas, AZ Metro Area",-699,"Sierra Vista-Douglas","AZ","AZ Metro Area",0
"326","Sioux City, IA-NE-SD Metro Area",-66,"Sioux City","IA","IA-NE-SD Metro Area",0
"327","Sioux Falls, SD Metro Area",-1039,"Sioux Falls","SD","SD Metro Area",0
"328","South Bend-Mishawaka, IN-MI Metro Area",-39,"South Bend-Mishawaka","IN","IN-MI Metro Area",0
"329","Spartanburg, SC Metro Area",-448,"Spartanburg","SC","SC Metro Area",0
"330","Spokane-Spokane Valley, WA Metro Area",-3023,"Spokane-Spokane Valley","WA","WA Metro Area",0
"331","Springfield, IL Metro Area",-125,"Springfield","IL","IL Metro Area",0
"332","Springfield, MA Metro Area",-173,"Springfield","MA","MA Metro Area",0
"333","Springfield, MO Metro Area",-563,"Springfield","MO","MO Metro Area",0
"334","Springfield, OH Metro Area",-179,"Springfield","OH","OH Metro Area",0
"335","St. Cloud, MN Metro Area",-139,"St. Cloud","MN","MN Metro Area",0
"336","St. George, UT Metro Area",-1453,"St. George","UT","UT Metro Area",0
"337","St. Joseph, MO-KS Metro Area",-6,"St. Joseph","MO","MO-KS Metro Area",0
"338","St. Louis, MO-IL Metro Area",-865,"St. Louis","MO","MO-IL Metro Area",0
"339","State College, PA Metro Area",-202,"State College","PA","PA Metro Area",0
"340","Staunton, VA Metro Area",-210,"Staunton","VA","VA Metro Area",0
"341","Stockton, CA Metro Area",-10732,"Stockton","CA","CA Metro Area",1
"342","Sumter, SC Metro Area",-136,"Sumter","SC","SC Metro Area",0
"343","Syracuse, NY Metro Area",-274,"Syracuse","NY","NY Metro Area",0
"344","Tallahassee, FL Metro Area",-90,"Tallahassee","FL","FL Metro Area",0
"345","Tampa-St. Petersburg-Clearwater, FL Metro Area",-1014,"Tampa-St. Petersburg-Clearwater","FL","FL Metro Area",0
"346","Terre Haute, IN Metro Area",-89,"Terre Haute","IN","IN Metro Area",0
"347","Texarkana, TX-AR Metro Area",-1,"Texarkana","TX","TX-AR Metro Area",0
"348","The Villages, FL Metro Area",-43,"The Villages","FL","FL Metro Area",0
"349","Toledo, OH Metro Area",-101,"Toledo","OH","OH Metro Area",0
"350","Topeka, KS Metro Area",-145,"Topeka","KS","KS Metro Area",0
"351","Trenton-Princeton, NJ Metro Area",-330,"Trenton-Princeton","NJ","NJ Metro Area",0
"352","Tucson, AZ Metro Area",-3632,"Tucson","AZ","AZ Metro Area",0
"353","Tulsa, OK Metro Area",-1675,"Tulsa","OK","OK Metro Area",0
"354","Tuscaloosa, AL Metro Area",-427,"Tuscaloosa","AL","AL Metro Area",0
"355","Twin Falls, ID Metro Area",-679,"Twin Falls","ID","ID Metro Area",0
"356","Tyler, TX Metro Area",-269,"Tyler","TX","TX Metro Area",0
"357","Urban Honolulu, HI Metro Area",-552,"Urban Honolulu","HI","HI Metro Area",0
"358","Utica-Rome, NY Metro Area",-31,"Utica-Rome","NY","NY Metro Area",0
"359","Valdosta, GA Metro Area",-43,"Valdosta","GA","GA Metro Area",0
"360","Vallejo, CA Metro Area",-8895,"Vallejo","CA","CA Metro Area",1
"361","Victoria, TX Metro Area",-87,"Victoria","TX","TX Metro Area",0
"362","Vineland-Bridgeton, NJ Metro Area",-30,"Vineland-Bridgeton","NJ","NJ Metro Area",0
"363","Virginia Beach-Norfolk-Newport News, VA-NC Metro Area",-2430,"Virginia Beach-Norfolk-Newport News","VA","VA-NC Metro Area",0
"364","Visalia, CA Metro Area",-2743,"Visalia","CA","CA Metro Area",1
"365","Waco, TX Metro Area",-1110,"Waco","TX","TX Metro Area",0
"366","Walla Walla, WA Metro Area",-338,"Walla Walla","WA","WA Metro Area",0
"367","Warner Robins, GA Metro Area",-268,"Warner Robins","GA","GA Metro Area",0
"368","Washington-Arlington-Alexandria, DC-VA-MD-WV Metro Area",-1766,"Washington-Arlington-Alexandria","DC","DC-VA-MD-WV Metro Area",0
"369","Waterloo-Cedar Falls, IA Metro Area",-308,"Waterloo-Cedar Falls","IA","IA Metro Area",0
"370","Watertown-Fort Drum, NY Metro Area",-182,"Watertown-Fort Drum","NY","NY Metro Area",0
"371","Wausau-Weston, WI Metro Area",-8,"Wausau-Weston","WI","WI Metro Area",0
"372","Weirton-Steubenville, WV-OH Metro Area",-82,"Weirton-Steubenville","WV","WV-OH Metro Area",0
"373","Wenatchee, WA Metro Area",-316,"Wenatchee","WA","WA Metro Area",0
"374","Wheeling, WV-OH Metro Area",-14,"Wheeling","WV","WV-OH Metro Area",0
"375","Wichita Falls, TX Metro Area",-341,"Wichita Falls","TX","TX Metro Area",0
"376","Wichita, KS Metro Area",-636,"Wichita","KS","KS Metro Area",0
"377","Williamsport, PA Metro Area",-75,"Williamsport","PA","PA Metro Area",0
"378","Wilmington, NC Metro Area",-126,"Wilmington","NC","NC Metro Area",0
"379","Winston-Salem, NC Metro Area",-359,"Winston-Salem","NC","NC Metro Area",0
"380","Worcester, MA-CT Metro Area",-386,"Worcester","MA","MA-CT Metro Area",0
"381","Yakima, WA Metro Area",-391,"Yakima","WA","WA Metro Area",0
"382","York-Hanover, PA Metro Area",-39,"York-Hanover","PA","PA Metro Area",0
"383","Youngstown-Warren-Boardman, OH-PA Metro Area",-157,"Youngstown-Warren-Boardman","OH","OH-PA Metro Area",0
"384","Yuba City, CA Metro Area",-2123,"Yuba City","CA","CA Metro Area",1
"385","Yuma, AZ Metro Area",-1210,"Yuma","AZ","AZ Metro Area",0
